[
  {
    "id": "a1",
    "source": {"name": "TechCrunch", "type": "tech_media", "url": "https://techcrunch.com/2026/06/12/metas-months-old-ai-unit-is-a-soul-crushing-gulag-say-the-engineers-stuck-inside-it/", "credibility": 0.92},
    "fetch_metadata": {"fetched_at": "2026-06-13T08:00:00Z", "method": "websearch", "agent_id": "collection_en_media"},
    "raw": {"title": "Meta's months-old AI unit is a soul-crushing gulag, say the engineers stuck inside it", "body": "Meta's three-month-old Applied AI team of approximately 6,500 engineers is on the verge of revolt. Employees describe it as a 'soul-crushing gulag' where staff are being 'drafted' into the unit involuntarily to generate puzzles for AI training. A livestreamed internal presentation was hijacked by an expletive-laden outburst. Over 1,600 employees signed a petition protesting keystroke and click monitoring for AI training data. Mark Zuckerberg issued an internal memo acknowledging the 'distress' but defending the program as essential for Meta's AI ambitions.", "published_at": "2026-06-12T14:00:00Z", "language": "en"}
  },
  {
    "id": "a2",
    "source": {"name": "TechCrunch", "type": "tech_media", "url": "https://techcrunch.com/2026/06/11/jeff-bezoss-prometheus-raises-12b-to-build-an-artificial-general-engineer-for-the-physical-world/", "credibility": 0.92},
    "fetch_metadata": {"fetched_at": "2026-06-13T08:00:00Z", "method": "websearch", "agent_id": "collection_en_media"},
    "raw": {"title": "Jeff Bezos's Prometheus raises $12B to build an 'artificial general engineer' for the physical world", "body": "Prometheus, the physical AI startup co-founded by Jeff Bezos, raised $12 billion at a $41 billion valuation. The company aims to build an 'artificial general engineer' that can automate design and manufacturing of complex physical systems including jet engines and drug compounds. The round was backed by JPMorgan Chase, Goldman Sachs, and BlackRock, signaling Wall Street's growing appetite for AI infrastructure bets.", "published_at": "2026-06-11T10:00:00Z", "language": "en"}
  },
  {
    "id": "a3",
    "source": {"name": "TechCrunch", "type": "tech_media", "url": "https://techcrunch.com/2026/06/09/google-just-fired-a-warning-shot-in-the-ai-subscription-price-wars/", "credibility": 0.92},
    "fetch_metadata": {"fetched_at": "2026-06-13T08:00:00Z", "method": "websearch", "agent_id": "collection_en_media"},
    "raw": {"title": "Google just fired a warning shot in the AI subscription price wars", "body": "Google cut the price of Google AI Plus from $7.99/month to $4.99/month while doubling storage to 400GB. This move brings the AI subscription price war that has been brewing in emerging markets like India squarely to U.S. consumers. OpenAI and Anthropic, both having confidentially filed for IPO, face intensifying commoditization pressure as competition drives prices down.", "published_at": "2026-06-09T16:00:00Z", "language": "en"}
  },
  {
    "id": "a4",
    "source": {"name": "TechCrunch", "type": "tech_media", "url": "https://techcrunch.com/2026/06/10/warner-music-acquires-ai-attribution-startup-sureel-ai/", "credibility": 0.92},
    "fetch_metadata": {"fetched_at": "2026-06-13T08:00:00Z", "method": "websearch", "agent_id": "collection_en_media"},
    "raw": {"title": "Warner Music acquires AI attribution startup Sureel AI", "body": "Warner Music Group has acquired Sureel AI, a startup that uses 'AI DNA' technology to track when artists' work is used in AI model training. The acquisition highlights the growing tension between the music industry and AI companies over copyright and attribution. Sureel's technology creates a fingerprint for creative works and monitors training datasets for unauthorized usage.", "published_at": "2026-06-10T12:00:00Z", "language": "en"}
  },
  {
    "id": "a5",
    "source": {"name": "The Verge", "type": "tech_media", "url": "https://www.theverge.com/2026/6/10/apple-wwdc-ai-nvidia", "credibility": 0.90},
    "fetch_metadata": {"fetched_at": "2026-06-13T08:00:00Z", "method": "websearch", "agent_id": "collection_en_media"},
    "raw": {"title": "Apple's AI runs on Nvidia chips: Inside the Private Cloud Compute reveal at WWDC 2026", "body": "At WWDC 2026, Apple revealed it worked with Nvidia, Google, and Intel to make Private Cloud Compute work. Apple's Foundation Model runs on Nvidia hardware within Google's cloud infrastructure, marking a significant departure from Apple's traditional preference for in-house silicon. The move signals that even Apple cannot escape Nvidia's dominance in AI compute.", "published_at": "2026-06-10T20:00:00Z", "language": "en"}
  },
  {
    "id": "a6",
    "source": {"name": "The Verge", "type": "tech_media", "url": "https://www.theverge.com/2026/6/8/openai-chatgpt-1-billion-users", "credibility": 0.90},
    "fetch_metadata": {"fetched_at": "2026-06-13T08:00:00Z", "method": "websearch", "agent_id": "collection_en_media"},
    "raw": {"title": "ChatGPT hit 1 billion monthly active users faster than any app in history", "body": "According to Sensor Tower data, ChatGPT reached 1 billion monthly active users, becoming the fastest application to achieve this milestone in history. The milestone underscores the unprecedented speed of AI adoption among consumers. OpenAI Codex also hit 5 million weekly active users with new plugins for building interactive hosted websites.", "published_at": "2026-06-08T10:00:00Z", "language": "en"}
  },
  {
    "id": "a7",
    "source": {"name": "TechCrunch", "type": "tech_media", "url": "https://techcrunch.com/2026/06/07/google-spacex-compute-deal/", "credibility": 0.92},
    "fetch_metadata": {"fetched_at": "2026-06-13T08:00:00Z", "method": "websearch", "agent_id": "collection_en_media"},
    "raw": {"title": "Google signs $920M/month deal with SpaceX for AI compute capacity", "body": "Google signed a deal to pay SpaceX $920 million per month from October 2026 through June 2029 to meet surging demand for Gemini Enterprise. The deal represents one of the largest cloud compute contracts in history and highlights the extreme demand for AI inference capacity.", "published_at": "2026-06-07T16:00:00Z", "language": "en"}
  },
  {
    "id": "a8",
    "source": {"name": "The Verge", "type": "tech_media", "url": "https://www.theverge.com/2026/6/3/microsoft-build-mai-models", "credibility": 0.90},
    "fetch_metadata": {"fetched_at": "2026-06-13T08:00:00Z", "method": "websearch", "agent_id": "collection_en_media"},
    "raw": {"title": "Microsoft unveils seven self-developed MAI models at Build 2026, ushering in the 'Agent-first' era", "body": "At Microsoft Build 2026, the company unveiled seven self-developed MAI models including MAI-Thinking-1, its first reasoning model, and MAI-Code-1-Flash for code generation. CEO Satya Nadella declared this the 'Agent-first era' where AI agents become the primary interface for computing. Broadcom projected $560 billion in AI chip revenue for fiscal 2026.", "published_at": "2026-06-03T18:00:00Z", "language": "en"}
  }
]