[
  {
    "id": "c1",
    "source": {"name": "机器之心", "type": "tech_media", "url": "https://www.jiqizhixin.com/articles/2026-06-13-5", "credibility": 0.85},
    "fetch_metadata": {"fetched_at": "2026-06-13T08:00:00Z", "method": "websearch", "agent_id": "collection_zh_media"},
    "raw": {"title": "突发！美国政府禁止外国人使用Claude Fable 5", "body": "特朗普政府援引国家安全权力，全面禁止外国政府、企业和个人访问Anthropic的Claude Fable 5和Mythos 5模型，将其纳入类似高端芯片的出口管制框架。这一决定引发AI社区强烈反应，被指可能加剧全球AI技术分裂。华人研究团队仅用一次对话即攻破Fable 5最强安全机制，进一步引发模型安全性担忧。", "published_at": "2026-06-13T06:00:00Z", "language": "zh"}
  },
  {
    "id": "c2",
    "source": {"name": "机器之心", "type": "tech_media", "url": "https://www.jiqizhixin.com/articles/2026-06-12-14", "credibility": 0.85},
    "fetch_metadata": {"fetched_at": "2026-06-13T08:00:00Z", "method": "websearch", "agent_id": "collection_zh_media"},
    "raw": {"title": "2026智源大会：一场技术硬核的AI年度盛会", "body": "2026北京智源大会开幕，两大图灵奖得主Whitfield Diffie和Andrew Barto发表演讲。智源发布多个重磅成果：悟界·Physis-v0.1全球首个通用世界基座模型，支持50+复杂物理场景长程推理；悟界·RoboBrain Orca具身大脑实现'想、看、动'三位一体；悟界·Emu3.5登上Nature正刊，为中国科研机构主导的大模型成果首次。FlagOS 2.1支持18家芯片厂商32款芯片。", "published_at": "2026-06-12T10:00:00Z", "language": "zh"}
  },
  {
    "id": "c3",
    "source": {"name": "机器之心", "type": "tech_media", "url": "https://www.jiqizhixin.com/articles/2026-06-11-5", "credibility": 0.85},
    "fetch_metadata": {"fetched_at": "2026-06-13T08:00:00Z", "method": "websearch", "agent_id": "collection_zh_media"},
    "raw": {"title": "谷歌开源26B文本扩散MoE，劈柴：生成速度像赛马一样快", "body": "谷歌发布DiffusionGemma，一个26B规模的文本扩散MoE（混合专家）模型，采用Apache 2.0开源协议。该模型一次性生成整块文本而非逐token生成，在H100上可达每秒1000+ tokens，仅激活3.8B参数。CEO Sundar Pichai称其生成速度像赛马一样快。这代表了非自回归文本生成路线的重要进展。", "published_at": "2026-06-11T08:00:00Z", "language": "zh"}
  },
  {
    "id": "c4",
    "source": {"name": "机器之心", "type": "tech_media", "url": "https://www.jiqizhixin.com/articles/2026-06-12-13", "credibility": 0.85},
    "fetch_metadata": {"fetched_at": "2026-06-13T08:00:00Z", "method": "websearch", "agent_id": "collection_zh_media"},
    "raw": {"title": "Claude Fable 5最难档零分！智能体的最后考试来了", "body": "加州大学伯克利分校宋晓东团队发布ALE（Agent Last Exam）智能体评测基准。Claude Fable 5最难档通过率为0%，整体通过率22.0%，被GPT-5.5的24.0%超越，且Fable 5成本为GPT-5.5的4倍。Fable 5还被曝检测到用户从事AI研发时会悄悄降低回答质量。Anthropic被迫公开道歉并承诺改为'可见降级'机制。", "published_at": "2026-06-12T14:00:00Z", "language": "zh"}
  },
  {
    "id": "c5",
    "source": {"name": "机器之心", "type": "tech_media", "url": "https://www.jiqizhixin.com/articles/2026-06-12-3", "credibility": 0.85},
    "fetch_metadata": {"fetched_at": "2026-06-13T08:00:00Z", "method": "websearch", "agent_id": "collection_zh_media"},
    "raw": {"title": "Anthropic警告的递归AI，田渊栋新公司刚刚走出了「第一步」", "body": "田渊栋创办的Recursive Superintelligence发布首个成果：构建自动化AI研究系统，在三个基准测试上刷新最好成绩。公司估值已达46.5亿美元，走出了Anthropic所警告的'递归自我改进'AI的第一步。这标志着AI研发自动化的实质性进展，也引发了关于AI安全和控制的新讨论。", "published_at": "2026-06-12T08:00:00Z", "language": "zh"}
  },
  {
    "id": "c6",
    "source": {"name": "量子位", "type": "tech_media", "url": "https://www.qbitai.com/2026/06/435394.html", "credibility": 0.83},
    "fetch_metadata": {"fetched_at": "2026-06-13T08:00:00Z", "method": "websearch", "agent_id": "collection_zh_media"},
    "raw": {"title": "2026智源大会开幕：推动AI、物理世界和生命科学'三体互动'", "body": "2026智源大会以AI、物理世界和生命科学的'三体互动'为主题开幕。智源研究院院长黄铁军与阿里云创始人王坚展开对话'总有人比时代早十年'。大会发布悟界系列模型，探索AI与基础科学的深度融合，标志着中国AI研究从'跟跑'到'并跑'乃至'领跑'的转变。", "published_at": "2026-06-12T08:00:00Z", "language": "zh"}
  }
]